{
  "schema": "ni.contract.v0",
  "readiness_profile": "prototype",
  "product_type": "software",
  "delivery_surfaces": ["cli", "document", "workflow"],
  "interaction_mode": "human_to_system",
  "project": {
    "id": "todo",
    "name": "TODO",
    "purpose": "TODO",
    "status": "draft"
  },
  "non_goals": [
    {
      "id": "NG-001",
      "title": "Do not implement execution adapters before the planning kernel is ready."
    }
  ],
  "capabilities": [
    {
      "id": "CAP-001",
      "title": "TODO",
      "status": "accepted",
      "requirements": [
        "REQ-001"
      ],
      "evaluations": [
        "EVAL-001"
      ],
      "risks": [
        "RISK-001"
      ],
      "artifacts": [
        "ART-001"
      ]
    }
  ],
  "requirements": [
    {
      "id": "REQ-001",
      "title": "TODO",
      "status": "accepted"
    }
  ],
  "decisions": [
    {
      "id": "DEC-001",
      "title": "TODO",
      "status": "accepted"
    }
  ],
  "risks": [
    {
      "id": "RISK-001",
      "title": "TODO",
      "severity": "high",
      "status": "accepted",
      "mitigation": "TODO"
    }
  ],
  "evaluations": [
    {
      "id": "EVAL-001",
      "title": "TODO",
      "method": "TODO"
    }
  ],
  "artifacts": [
    {
      "id": "ART-001",
      "path": "TODO",
      "kind": "TODO"
    }
  ],
  "open_questions": [
    {
      "id": "OQ-001",
      "title": "TODO",
      "blocker": true,
      "status": "open"
    }
  ]
}
